id,created_at,title,imagepath,thumbpath,summary,description,category_id,author_id
1,2026-02-22 12:05:49.126047+00,Coffee,images/icon-1.png,images/icon-1.png,"Coffee energizes the mind, warms the soul, and fuels creativity daily.","<p>Coffee is more than just a beverage; it's a ritual that starts the day for millions around the world. The aroma of freshly brewed coffee is enough to awaken the senses, offering a comforting embrace that signals the beginning of a new day. Whether enjoyed black, with cream, or sweetened to perfection, coffee has a unique way of catering to individual tastes while providing a moment of solace amidst the rush of life.</p>             <p>Beyond its stimulating effects, coffee is a catalyst for connection and conversation. Cafés serve as gathering places where friends catch up, ideas are exchanged, and creativity flourishes. The act of sharing a cup of coffee can bridge distances, making it a symbol of hospitality and warmth. From the simple pleasure of a morning cup to the intricate art of crafting the perfect espresso, coffee is a beloved companion that transcends cultures and generations.</p>",1,
2,2026-02-22 12:05:49.126047+00,Drinks,images/icon-2.png,images/icon-2.png,"Drinks refresh, rejuvenate, and bring people together in joyful moments.","<p>Drinks play a vital role in our daily lives, offering not just hydration but also pleasure and comfort. From the simple act of sipping water to quench thirst to the enjoyment of a carefully crafted cocktail, drinks have the power to enhance our moods and experiences. Whether it's a morning coffee that jumpstarts the day, a refreshing juice that cools on a hot afternoon, or a glass of wine that complements a meal, each drink carries its own significance and serves a purpose.</p>            <p>Social gatherings often revolve around drinks, creating opportunities for connection and celebration. Sharing a drink, whether it's a casual beer with friends or a festive toast at a wedding, fosters a sense of camaraderie and shared experience. Drinks also carry cultural meanings, with different beverages symbolizing traditions and rituals across the world. From the British tea time to the Japanese tea ceremony, drinks are woven into the fabric of societies, reflecting both history and lifestyle.</p>             <p>Drinks also serve as an expression of creativity and craftsmanship, with countless varieties and combinations that cater to diverse tastes. Bartenders, baristas, and mixologists turn the preparation of drinks into an art form, experimenting with flavors, ingredients, and presentation to create unique and memorable experiences. Whether it's the perfect pour of a frothy cappuccino, the delicate balance of flavors in a craft cocktail, or the intricate layers of a latte art design, the world of drinks offers endless possibilities for innovation and enjoyment.</p>",1,
3,2026-02-22 12:05:49.126047+00,Cakes,images/icon-3.png,images/icon-3.png,"Cakes sweeten celebrations, delighting taste buds with layers of joy.","<p>Cakes are the centerpiece of celebrations, symbolizing joy and festivity with their sweet allure. Whether it's a birthday, wedding, or holiday, a beautifully crafted cake adds a special touch to any occasion. The soft layers, often frosted and filled with delicious creams or fruits, are not just a treat for the taste buds but also a visual delight. From classic vanilla and chocolate to more adventurous flavors like red velvet or matcha, cakes offer something for everyone, making them a universally loved dessert.</p>             <p>The art of cake-making has evolved significantly over the years, with bakers experimenting with flavors, textures, and designs to create masterpieces that are as beautiful as they are delicious. The rise of fondant, edible flowers, and intricate piping techniques has transformed cakes into stunning works of art. Whether it's a simple homemade cake or an elaborate tiered creation, the time and effort put into crafting these desserts reflect the love and care behind them.</p>             <p>Cakes also carry cultural significance, with different regions boasting their own unique varieties and traditions. In some cultures, specific cakes are made for particular celebrations, such as fruitcakes for Christmas or mooncakes for the Mid-Autumn Festival. These traditional cakes are often steeped in history and are enjoyed not just for their taste but for the memories and customs they represent. Whether enjoyed as a daily indulgence or a special treat, cakes remain a symbol of happiness, creativity, and cultural heritage.</p>",1,
4,2026-02-22 12:05:49.126047+00,Ice-creams,images/icon-4.png,images/icon-4.png,"Ice creams cool, delight, and bring sweet joy to everyone.","<p>Ice cream is a beloved treat that has a universal appeal, offering a sweet escape from the heat and a moment of pure indulgence. Its creamy texture and endless variety of flavors make it a favorite among all age groups, whether enjoyed in a cone, a cup, or as part of a sundae. From the classic vanilla and chocolate to more exotic flavors like lavender or salted caramel, ice cream caters to every palate, turning any moment into a special occasion.</p>             <p>The artistry of ice cream-making has evolved over time, with artisan shops and big brands alike pushing the boundaries of creativity. Ingredients like fresh fruits, nuts, and chocolates are often combined with innovative methods to create unique textures and taste experiences. Gourmet ice creams have become increasingly popular, with offerings that include dairy-free, vegan, and even savory options. These variations make ice cream not just a dessert, but a canvas for culinary experimentation and innovation.</p>             <p>Ice cream also carries with it a sense of nostalgia and joy, often bringing back memories of childhood and carefree summer days. It's a treat that transcends cultural boundaries, enjoyed by people all around the world in different forms. Whether it's a simple scoop shared among friends or an elaborate dessert at a fine dining restaurant, ice cream has the power to bring smiles and create cherished memories, making it a timeless favorite.</p>",1,
5,2026-02-23 12:05:49.126047+00,Coffee Enthusiasts Rejoice,,,New Study Reveals Coffee's Surprising Benefits for Mental Health,"<p>In a groundbreaking study published this week, researchers have unveiled compelling evidence suggesting that coffee might do more than just perk up your mornings. The study, conducted by a team of neuroscientists, reveals that moderate coffee consumption is linked to improved cognitive function and a reduced risk of developing neurodegenerative diseases such as Alzheimer's and Parkinson's.</p><p>The research, which analyzed data from over 50,000 participants, found that those who drank one to three cups of coffee daily showed a notable increase in memory retention and mental clarity. The key, according to the study, is the high concentration of antioxidants and neuroprotective compounds found in coffee. These elements appear to counteract oxidative stress and inflammation in the brain, potentially slowing cognitive decline.</p><p>Coffee aficionados may also be thrilled to learn that the benefits extend beyond mental health. The study suggests that coffee consumption is associated with a lower incidence of depression and improved overall mood. As always, moderation is crucial, but this new research offers an exciting perspective on how a daily cup of coffee might contribute to long-term brain health and emotional well-being. So, the next time you savor your favorite brew, you might just be giving your brain a boost in the process.</p>",3,
6,2026-02-24 12:05:49.126047+00,Culinary Revolution,,,AI Chefs Redefine Gourmet Dining with Innovative Dishes,"<p>In a groundbreaking development, artificial intelligence (AI) is making its mark on the culinary world, creating a new wave of gourmet dining experiences. A recent collaboration between top chefs and tech innovators has resulted in the debut of AI-designed dishes that are pushing the boundaries of flavor and presentation.</p><p>These AI chefs use advanced algorithms to analyze thousands of recipes and flavor profiles, generating unique combinations that are both surprising and delightful. One of the standout creations is a fusion dish that combines traditional French cuisine with unexpected Asian ingredients, resulting in an exquisitely balanced and novel flavor profile. Diners have reported an extraordinary gastronomic experience, with the AI-designed dishes providing a fresh perspective on culinary possibilities.</p><p>This trend is not only revolutionizing the way we think about food but also sparking conversations about the future of dining. As AI continues to advance, it promises to bring even more creativity and innovation to the table, transforming the food industry and offering adventurous eaters new and exciting dining experiences.</p>",3,
7,2026-02-25 12:05:49.126047+00,Our Cakes,,,Cake Artistry Reaches New Heights with 3D-Printed Edible Masterpieces,"<p>In a delicious twist on culinary creativity, 3D printing technology is revolutionizing the world of cake design. A new trend in cake artistry involves using 3D printers to create intricate, customizable cake decorations that were once thought impossible. These edible masterpieces are not only visually stunning but also tailored to individual tastes and preferences.
    </p> <p>The process involves creating detailed 3D models of cake decorations, which are then printed layer by layer using edible materials like fondant, chocolate, and sugar. This technology allows for the creation of elaborate designs, such as lifelike floral arrangements, intricate geometric patterns, and even personalized figurines that perfectly match the theme of any celebration.</p> <p>Bakers and cake enthusiasts are embracing this innovation, which offers unprecedented precision and creativity in cake decoration. The ability to produce such detailed and unique designs has elevated cakes from simple desserts to works of art, transforming ordinary celebrations into extraordinary events. As 3D printing continues to evolve, the future of cake artistry promises even more exciting and imaginative possibilities.</p>",3,
8,2026-02-22 12:05:49.126047+00,About us,images/about_1.jpg,images/about-1.jpg,"<h2 class='text-3xl text-neutral-700'>Exploring the Web1 Project: A Student's Journey in Modern Web Development</h2>            <p>Welcome to the Web1 project, a student's exploration into the world of web development. This website serves as a hands-on practice platform, showcasing skills in HTML5, CSS3, JavaScript, TailwindCSS, HandlebarJS, and Web API integration. Designed to demonstrate the practical application of these technologies, the project offers a glimpse into modern web development techniques and the process of creating dynamic, responsive websites. Whether you're interested in learning more about web development or simply exploring a student's work, this project highlights the fundamental tools and methodologies used in crafting contemporary web experiences.</p>","<h2 class='text-3xl text-neutral-700'> Exploring the Web1 Project: A Student's Journey in Modern Web Development</h2><p>The Web1 project represents a significant milestone in a student's journey through web development, providing a practical platform to apply learned skills. By utilizing key technologies like HTML5, CSS3, JavaScript, TailwindCSS, HandlebarJS, and Web API, this project demonstrates a comprehensive understanding of the tools and techniques essential for building dynamic websites. The project's primary goal is to create a fully functional website that incorporates responsive design and interactive elements, reflecting the core principles of modern web development.</p> <p>HTML5 and CSS3 form the backbone of the Web1 project, establishing a strong foundation for the site's structure and style. HTML5 allows for semantic, accessible content, while CSS3 enhances the visual appeal through advanced styling techniques. Together, these technologies ensure that the website is both user-friendly and aesthetically pleasing. The integration of TailwindCSS further refines the design, providing a responsive grid system and pre-designed components that streamline the development process and ensure a consistent, polished look across various devices.</p> <p>JavaScript plays a crucial role in adding interactivity to the Web1 project. By incorporating JavaScript, the site can respond to user actions, handle dynamic content updates, and enhance overall user experience. This scripting language allows for the implementation of features like form validation, interactive elements, and real-time data manipulation, making the website more engaging and functional.</p> <p>HandlebarJS is employed in the Web1 project to facilitate efficient templating and data rendering. This JavaScript library enables the creation of dynamic templates that simplify the management of complex data structures and enhance the site's scalability. With HandlebarJS, the project can efficiently render and update content, allowing for a more modular and maintainable codebase.</p> <p>The integration of Web API further extends the capabilities of the Web1 project, enabling the site to interact with external data sources and services. By leveraging APIs, the project can incorporate real-time data, such as weather information or social media feeds, providing users with up-to-date and relevant content. This feature highlights the project's ability to connect with the broader web ecosystem and showcases the student's proficiency in integrating various technologies to build a robust and interactive web application.</p>",2,
9,2026-02-22 12:05:49.126047+00,Global Flavor Innovation,images/vision/vision_1.jpg,images/vision/vision-1.jpg,"Innovate with global flavors to create unique, exciting culinary experiences","<p>Global Flavor Innovation aims to transform the culinary landscape by integrating diverse ingredients and cooking techniques from around the world. This approach not only broadens the palate but also fosters a deeper appreciation for different cultures. By experimenting with unique flavor combinations and traditional methods, chefs can create dishes that are both novel and memorable. This vision celebrates the richness of global cuisine while encouraging creativity and culinary exploration.</p> <p>Chefs and food enthusiasts alike are encouraged to push the boundaries of conventional cooking by incorporating elements from various culinary traditions. The fusion of distinct flavors and techniques can lead to groundbreaking dishes that surprise and delight diners. This approach emphasizes the importance of innovation in the kitchen, as well as the value of cross-cultural culinary exchange.</p> <p>In practice, Global Flavor Innovation involves sourcing exotic ingredients, exploring lesser-known culinary traditions, and adapting techniques to suit contemporary tastes. This can result in exciting new dishes that capture the essence of diverse cultures while appealing to modern sensibilities. The vision also highlights the role of food as a bridge between different cultures, promoting understanding and appreciation through shared dining experiences.</p> <p>Ultimately, Global Flavor Innovation seeks to elevate the dining experience by offering dishes that are both adventurous and approachable. By embracing the diversity of global cuisines and infusing them with creativity, this vision aims to create a culinary landscape that is vibrant, inclusive, and continuously evolving.</p>",4,
10,2026-02-22 12:05:49.126047+00,Crafting Elevated Beverages,images/vision/vision_2.jpg,images/vision/vision-2.jpg,Craft artisanal beverages with high-quality ingredients for a refined experience.,"<p>Crafting Elevated Beverages focuses on enhancing the drinking experience through artisanal techniques and high-quality ingredients. This vision prioritizes the creation of beverages that are not only refreshing but also sophisticated, reflecting a commitment to craftsmanship and attention to detail. By refining traditional drink recipes and experimenting with new flavors, this approach aims to offer a premium drinking experience.</p> <p> Artisanal methods, such as small-batch production and hand-selected ingredients, play a crucial role in this vision. These practices ensure that each beverage is crafted with precision and care, resulting in unique and high-quality drinks that stand out from mass-produced options. The emphasis is on creating beverages that offer a rich sensory experience, from taste to aroma.</p> <p>Innovation is also a key component of Crafting Elevated Beverages. By incorporating modern techniques and creative flavor combinations, this vision encourages the exploration of new and exciting drink options. Whether through inventive cocktail recipes, specialty teas, or artisanal coffees, the goal is to provide consumers with beverages that are both distinctive and enjoyable.</p> <p>In essence, Crafting Elevated Beverages seeks to redefine the drinking experience by offering drinks that are crafted with expertise and creativity. This vision aims to provide consumers with a refined and memorable experience, elevating everyday beverages to new heights of sophistication and enjoyment.</p>",4,
14,2026-02-22 12:05:49.126047+00,Emily Cramer,images/our-team/team_1.jpg,images/our-team/team-1.jpg,Elevating Tradition with Modern Elegance.,"<p>Emily Cramer is a visionary chef known for her innovative approach to modern cuisine. With a background in classical French cooking and a passion for local, sustainable ingredients, Emily has established herself as a leading figure in the culinary world. Her culinary journey began at a prestigious culinary school, where she honed her skills and developed a unique style that blends traditional techniques with contemporary flair.</p>
<p>
Her career has been marked by numerous accolades and awards, including recognition for her inventive dishes and exceptional presentation. Emily's kitchen is a place where creativity thrives, and she is known for pushing the boundaries of flavor and texture. Her commitment to using seasonal, locally-sourced ingredients ensures that each dish not only tastes exquisite but also supports the community and the environment.</p>
<p>
In addition to her work in the kitchen, Emily is an advocate for culinary education and mentorship. She regularly conducts workshops and classes, sharing her expertise with aspiring chefs and home cooks alike. Her dedication to teaching and her enthusiasm for food inspire many to explore their own culinary passions.</p>
<p>
Emily's restaurant is a testament to her culinary philosophy, offering a menu that reflects her dedication to excellence and innovation. Diners can expect a dining experience that is both refined and adventurous, showcasing Emily's talent for creating dishes that are as beautiful as they are delicious.</p>",5,
15,2026-02-22 12:05:49.126047+00,Michael Dutton,images/our-team/team_2.jpg,images/our-team/team-2.jpg,"Bold Flavors, Innovative Creations.","<p>Michael Dutton is a renowned chef celebrated for his expertise in modern American cuisine. With a culinary career spanning over two decades, Michael has become a prominent figure in the food industry, known for his ability to elevate traditional dishes with a contemporary twist. His journey began in his family's kitchen, where he developed a love for cooking that eventually led him to prestigious culinary schools and restaurants.</p>
<p>
Michael's approach to cooking is characterized by his focus on bold flavors and innovative techniques. His dishes often feature unexpected combinations that surprise and delight the palate, reflecting his deep understanding of both classic and modern culinary principles. His work has earned him critical acclaim and a loyal following of food enthusiasts.</p>
<p>
Beyond his restaurant, Michael is also dedicated to community involvement and charitable causes. He frequently participates in events that support local farmers and food banks, demonstrating his commitment to giving back and fostering a positive impact through his culinary skills. His leadership extends to mentoring young chefs, helping them develop their own talents and careers.</p>
<p>
Michael's restaurant offers a dining experience that embodies his culinary vision, with a menu that showcases his creative flair and dedication to quality. Each dish is crafted with precision and care, providing diners with an unforgettable taste of modern American cuisine.</p>",5,
16,2026-02-22 12:05:49.126047+00,Cristal Adams,images/our-team/team_3.jpg,images/our-team/team-3.jpg,"Refined Dishes, Artfully Crafted.","<p>Cristal Adams is a celebrated chef known for her exceptional skills in creating elegant and refined dishes. Her culinary career began with a passion for baking, which soon expanded into a broader exploration of gourmet cuisine. Cristal's meticulous attention to detail and commitment to perfection have earned her widespread recognition and admiration in the culinary community.</p>
<p>
Her cooking style is marked by a harmonious blend of classic techniques and contemporary influences. Cristal's dishes are characterized by their sophisticated flavors and artful presentation, reflecting her dedication to both culinary excellence and visual appeal. Her ability to create memorable dining experiences has made her a sought-after chef for high-profile events and exclusive dining experiences.</p>
<p>
Cristal is also an advocate for sustainable and ethical cooking practices. She emphasizes the use of organic and locally-sourced ingredients, ensuring that her dishes not only taste exceptional but also align with her values of environmental responsibility and community support. Her approach to cooking is both innovative and mindful, reflecting her commitment to making a positive impact.</p>
<p>
In her restaurant, Cristal delivers a dining experience that is both luxurious and approachable. Each dish is crafted with a blend of creativity and precision, offering guests a taste of her culinary artistry and passion. Dining with Cristal is an experience that highlights the beauty and depth of gourmet cuisine.</p>",5,
17,2026-02-22 12:05:49.126047+00,David Farmer,images/our-team/team_4.jpg,images/our-team/team-4.jpg,"Fresh Flavors, Farm-to-Table Excellence.","<p>David Farmer is a distinguished chef renowned for his mastery of farm-to-table cuisine. With a career rooted in a deep appreciation for fresh, seasonal ingredients, David has built a reputation for creating dishes that celebrate the natural flavors of his ingredients. His journey began on his family farm, where he learned the value of high-quality produce and developed a lifelong passion for cooking.</p>
<p>
David's culinary approach is centered around simplicity and authenticity. He focuses on highlighting the inherent flavors of his ingredients, using minimalistic techniques that allow the natural tastes to shine. His dedication to farm-to-table principles has garnered him acclaim for both his innovative dishes and his commitment to sustainability.</p>
<p>
In addition to his culinary achievements, David is a strong advocate for local agriculture and community engagement. He collaborates with local farmers and producers to ensure that his ingredients are sourced responsibly, and he often participates in community events that promote sustainable food practices. His efforts extend beyond the kitchen, making a positive impact on both the environment and the local food economy.</p>
<p>
David's restaurant offers a dining experience that reflects his commitment to farm-to-table excellence. Guests can enjoy dishes that are both flavorful and thoughtfully prepared, showcasing David's talent for transforming fresh ingredients into exceptional culinary creations. Dining with David is an experience that celebrates the essence of quality and sustainability in food.</p>",5,
21,2026-02-22 12:06:07.203045+00,Lemon Juice,images/gallery/gallery-img1.jpg,images/gallery/gallery-thumb1.jpg,,"<p>Strawberries, with their vibrant color and naturally sweet flavor, are a perfect ingredient for crafting refreshing drinks. Whether you’re looking to enjoy a classic strawberry lemonade, a smoothie, or a sparkling mocktail, strawberries offer a burst of flavor and a touch of elegance to any beverage. In this blog, we’ll explore a variety of strawberry-based drinks, highlighting their versatility and providing you with inspiration to make your next drink a delightful experience.</p>",18,
22,2026-02-22 12:06:07.203045+00,Coffee and Cheesecake,images/gallery/gallery-img2.jpg,images/gallery/gallery-thumb2.jpg,,"<p>When it comes to indulgent treats, few combinations can rival the harmony of coffee and cheesecake. This dynamic duo brings together two beloved flavors, each enhancing the other in a delightful symphony of taste and texture. In this blog, we explore the art of pairing coffee with cheesecake, offering tips on how to elevate your dessert experience to new heights.</p>",19,
23,2026-02-22 12:06:07.203045+00,Rainbow Cupcakes,images/gallery/gallery-img3.jpg,images/gallery/gallery-thumb3.jpg,,"<p>Rainbow cupcakes are a vibrant and fun treat that brings a splash of color and joy to any occasion. Perfect for birthdays, baby showers, or simply to brighten up a day, these cupcakes are as delightful to look at as they are to eat. In this blog, we'll explore how to make rainbow cupcakes from scratch, offer tips for achieving that perfect swirl of colors, and provide ideas for decorating these cheerful confections.</p>",20,
